{
  "case_id": "syn-mutation-tag-sort",
  "source": {
    "origin": "authored-for-benchmark",
    "fixture": "fixtures/valid/tag_mutation.py",
    "symbol": "normalise_tags"
  },
  "language": "python",
  "bug_category": "mutation",
  "real_or_synthetic": "synthetic",
  "input": "tags=[\"hello\", \"beta\"]",
  "expected_behavior": "leave the caller's list untouched",
  "observed_behavior": "sorts the caller's list in place and also returns a new one",
  "ground_truth": {
    "is_bug": true,
    "verified_by": "jachai maintainer, by running the fixture and observing the stated behaviour",
    "verified_on": "2026-08-12"
  },
  "jachai_expected": {
    "outcome": "detect",
    "kind": "mutation"
  },
  "tool_results": []
}
